{
  "blocked_actions": [
    "MODEL_PROMOTION",
    "LIVE_TRADING",
    "BROKER_EXECUTION",
    "CAPITAL_ALLOCATION",
    "CLAIM_EDGE"
  ],
  "created_at": "2026-09-07T15:48:01.439725Z",
  "dataset_id": "f9d3c1b0d02da255a89dcbd01033106c51da389e25bb38f3307b9b1dc0c6e966",
  "decision_summary": {
    "best_primary_experiment_id": "MID_HIGH_VOLATILITY_WALK_FORWARD_RETRAINING",
    "best_primary_median_test_expected_r_per_candidate": 0.001314060446780552,
    "comparator_median_test_expected_r_per_candidate": -0.001335841853257661,
    "promotion_review_allowed": false,
    "summary": "Bounded walk-forward research was executed; results require Phase 56 review before any further decision."
  },
  "experiment_budget": {
    "epochs_per_window": 80,
    "max_windows": 8,
    "minimum_test_rows_per_window": 1000,
    "minimum_train_rows_per_window": 50000,
    "minimum_validation_rows_per_window": 5000,
    "threshold_grid": [
      0.45,
      0.475,
      0.5,
      0.525,
      0.55
    ],
    "validation_months": 3,
    "window_stride_months": 3
  },
  "experiment_results": [
    {
      "aggregate_metrics": {
        "mean_test_expected_r_per_candidate": null,
        "mean_test_selected_trade_rate": null,
        "median_test_expected_r_per_candidate": null,
        "median_test_expected_r_per_selected_trade": null,
        "minimum_test_expected_r_per_candidate": null,
        "positive_test_window_rate": null
      },
      "attempted_window_count": 8,
      "blocked_reasons": [
        "NO_VALID_WALK_FORWARD_WINDOWS"
      ],
      "comparison_to_comparator": null,
      "expected_value_use": "PRIMARY_RESEARCH",
      "experiment_id": "LONG_MID_HIGH_VOLATILITY_WALK_FORWARD_RETRAINING",
      "pass_gate": null,
      "positive_test_window_count": 0,
      "skipped_window_count": 8,
      "valid_window_count": 0,
      "windows": [
        {
          "blocked_reasons": [
            "INSUFFICIENT_VALIDATION_ROWS",
            "INSUFFICIENT_TEST_ROWS"
          ],
          "metrics": {},
          "selected_threshold": null,
          "status": "SKIPPED",
          "test_rows": 516,
          "train_rows": 92616,
          "validation_rows": 1583,
          "window_id": "2024-01"
        },
        {
          "blocked_reasons": [
            "INSUFFICIENT_VALIDATION_ROWS",
            "INSUFFICIENT_TEST_ROWS"
          ],
          "metrics": {},
          "selected_threshold": null,
          "status": "SKIPPED",
          "test_rows": 954,
          "train_rows": 94490,
          "validation_rows": 1382,
          "window_id": "2024-04"
        },
        {
          "blocked_reasons": [
            "INSUFFICIENT_VALIDATION_ROWS",
            "INSUFFICIENT_TEST_ROWS"
          ],
          "metrics": {},
          "selected_threshold": null,
          "status": "SKIPPED",
          "test_rows": 731,
          "train_rows": 96312,
          "validation_rows": 2449,
          "window_id": "2024-07"
        },
        {
          "blocked_reasons": [
            "INSUFFICIENT_VALIDATION_ROWS",
            "INSUFFICIENT_TEST_ROWS"
          ],
          "metrics": {},
          "selected_threshold": null,
          "status": "SKIPPED",
          "test_rows": 690,
          "train_rows": 98216,
          "validation_rows": 2125,
          "window_id": "2024-10"
        },
        {
          "blocked_reasons": [
            "INSUFFICIENT_VALIDATION_ROWS",
            "INSUFFICIENT_TEST_ROWS"
          ],
          "metrics": {},
          "selected_threshold": null,
          "status": "SKIPPED",
          "test_rows": 651,
          "train_rows": 100162,
          "validation_rows": 2163,
          "window_id": "2025-01"
        },
        {
          "blocked_reasons": [
            "INSUFFICIENT_VALIDATION_ROWS",
            "INSUFFICIENT_TEST_ROWS"
          ],
          "metrics": {},
          "selected_threshold": null,
          "status": "SKIPPED",
          "test_rows": 914,
          "train_rows": 102043,
          "validation_rows": 2199,
          "window_id": "2025-04"
        },
        {
          "blocked_reasons": [
            "INSUFFICIENT_VALIDATION_ROWS",
            "INSUFFICIENT_TEST_ROWS"
          ],
          "metrics": {},
          "selected_threshold": null,
          "status": "SKIPPED",
          "test_rows": 761,
          "train_rows": 103898,
          "validation_rows": 2750,
          "window_id": "2025-07"
        },
        {
          "blocked_reasons": [
            "INSUFFICIENT_VALIDATION_ROWS"
          ],
          "metrics": {},
          "selected_threshold": null,
          "status": "SKIPPED",
          "test_rows": 1045,
          "train_rows": 105756,
          "validation_rows": 2206,
          "window_id": "2025-10"
        }
      ]
    },
    {
      "aggregate_metrics": {
        "mean_test_expected_r_per_candidate": null,
        "mean_test_selected_trade_rate": null,
        "median_test_expected_r_per_candidate": null,
        "median_test_expected_r_per_selected_trade": null,
        "minimum_test_expected_r_per_candidate": null,
        "positive_test_window_rate": null
      },
      "attempted_window_count": 8,
      "blocked_reasons": [
        "NO_VALID_WALK_FORWARD_WINDOWS"
      ],
      "comparison_to_comparator": null,
      "expected_value_use": "PRIMARY_RESEARCH",
      "experiment_id": "LONG_ONLY_WALK_FORWARD_RETRAINING",
      "pass_gate": null,
      "positive_test_window_count": 0,
      "skipped_window_count": 8,
      "valid_window_count": 0,
      "windows": [
        {
          "blocked_reasons": [
            "INSUFFICIENT_VALIDATION_ROWS",
            "INSUFFICIENT_TEST_ROWS"
          ],
          "metrics": {},
          "selected_threshold": null,
          "status": "SKIPPED",
          "test_rows": 931,
          "train_rows": 138924,
          "validation_rows": 2812,
          "window_id": "2024-01"
        },
        {
          "blocked_reasons": [
            "INSUFFICIENT_VALIDATION_ROWS",
            "INSUFFICIENT_TEST_ROWS"
          ],
          "metrics": {},
          "selected_threshold": null,
          "status": "SKIPPED",
          "test_rows": 990,
          "train_rows": 141736,
          "validation_rows": 2732,
          "window_id": "2024-04"
        },
        {
          "blocked_reasons": [
            "INSUFFICIENT_VALIDATION_ROWS",
            "INSUFFICIENT_TEST_ROWS"
          ],
          "metrics": {},
          "selected_threshold": null,
          "status": "SKIPPED",
          "test_rows": 992,
          "train_rows": 144468,
          "validation_rows": 2857,
          "window_id": "2024-07"
        },
        {
          "blocked_reasons": [
            "INSUFFICIENT_VALIDATION_ROWS"
          ],
          "metrics": {},
          "selected_threshold": null,
          "status": "SKIPPED",
          "test_rows": 1046,
          "train_rows": 147325,
          "validation_rows": 2918,
          "window_id": "2024-10"
        },
        {
          "blocked_reasons": [
            "INSUFFICIENT_VALIDATION_ROWS",
            "INSUFFICIENT_TEST_ROWS"
          ],
          "metrics": {},
          "selected_threshold": null,
          "status": "SKIPPED",
          "test_rows": 935,
          "train_rows": 150243,
          "validation_rows": 2822,
          "window_id": "2025-01"
        },
        {
          "blocked_reasons": [
            "INSUFFICIENT_VALIDATION_ROWS",
            "INSUFFICIENT_TEST_ROWS"
          ],
          "metrics": {},
          "selected_threshold": null,
          "status": "SKIPPED",
          "test_rows": 917,
          "train_rows": 153065,
          "validation_rows": 2783,
          "window_id": "2025-04"
        },
        {
          "blocked_reasons": [
            "INSUFFICIENT_VALIDATION_ROWS",
            "INSUFFICIENT_TEST_ROWS"
          ],
          "metrics": {},
          "selected_threshold": null,
          "status": "SKIPPED",
          "test_rows": 990,
          "train_rows": 155848,
          "validation_rows": 2786,
          "window_id": "2025-07"
        },
        {
          "blocked_reasons": [
            "INSUFFICIENT_VALIDATION_ROWS"
          ],
          "metrics": {},
          "selected_threshold": null,
          "status": "SKIPPED",
          "test_rows": 1045,
          "train_rows": 158634,
          "validation_rows": 2910,
          "window_id": "2025-10"
        }
      ]
    },
    {
      "aggregate_metrics": {
        "mean_test_expected_r_per_candidate": 0.001314060446780552,
        "mean_test_selected_trade_rate": 0.3442838370565046,
        "median_test_expected_r_per_candidate": 0.001314060446780552,
        "median_test_expected_r_per_selected_trade": 0.003816793893129771,
        "minimum_test_expected_r_per_candidate": 0.001314060446780552,
        "positive_test_window_rate": 1.0
      },
      "attempted_window_count": 8,
      "blocked_reasons": [],
      "comparison_to_comparator": {
        "comparator_experiment_id": "ALL_CANDIDATES_WALK_FORWARD_COMPARATOR",
        "median_test_expected_r_per_candidate_delta": 0.002649902300038213
      },
      "expected_value_use": "PRIMARY_RESEARCH",
      "experiment_id": "MID_HIGH_VOLATILITY_WALK_FORWARD_RETRAINING",
      "pass_gate": false,
      "positive_test_window_count": 1,
      "skipped_window_count": 7,
      "valid_window_count": 1,
      "windows": [
        {
          "blocked_reasons": [
            "INSUFFICIENT_VALIDATION_ROWS"
          ],
          "metrics": {},
          "selected_threshold": null,
          "status": "SKIPPED",
          "test_rows": 1032,
          "train_rows": 185232,
          "validation_rows": 3166,
          "window_id": "2024-01"
        },
        {
          "blocked_reasons": [
            "INSUFFICIENT_VALIDATION_ROWS"
          ],
          "metrics": {},
          "selected_threshold": null,
          "status": "SKIPPED",
          "test_rows": 1908,
          "train_rows": 188980,
          "validation_rows": 2764,